{
  "schema_version": "oerf-n2-real-bost-contract-1.0",
  "record_kind": "LAB_INTAKE_PLACEHOLDER",
  "identity": {
    "dataset_id": "REPLACE_ME",
    "case_id": "REPLACE_ME",
    "data_origin": "unknown",
    "run_id": "REPLACE_ME",
    "session_id": "REPLACE_ME",
    "condition_id": "REPLACE_ME",
    "geometry_id": "REPLACE_ME",
    "independent_unit": "unknown",
    "field_is_time_resolved": false,
    "acquisition_time_utc": null
  },
  "provenance": {
    "evidence_class": "unknown",
    "manifest_path": null,
    "manifest_digest_sha256": null,
    "manifest_entry_count": 0,
    "source_evidence_path": null,
    "verified_at_utc": null
  },
  "field_domain": {
    "parameterization": "unknown",
    "units": "unknown",
    "axis_order": "unknown",
    "grid_shape": null,
    "bounds_m": null,
    "support_path": null,
    "truth_available": false,
    "truth_path": null,
    "truth_provenance": "unknown"
  },
  "sensors": [],
  "views": [],
  "forward_model": {
    "regime": "unknown",
    "interface": "none",
    "implementation_id": "REPLACE_ME",
    "deterministic": false,
    "aperture_model": "unknown",
    "ray_bending": null,
    "optical_flow_inside_forward": null,
    "normalization_id": "REPLACE_ME",
    "can_apply_forward": false,
    "can_apply_adjoint": false,
    "can_jvp": false,
    "can_vjp": false,
    "can_export_tiny_matrix": false,
    "row_layout_documented": false
  },
  "operator_audit": {
    "dot_product": {"required": true, "relative_error": null},
    "finite_difference": {"required": false, "relative_error": null},
    "unit_scale_passed": null,
    "support_mask_passed": null
  },
  "physical_mismatch": {
    "primary": "unknown",
    "secondary": [],
    "frozen_before_audit": false,
    "evidence": {
      "f_number_levels": [],
      "calibration_versions": [],
      "displacement_methods": [],
      "discretization_levels": [],
      "condition_evidence": [],
      "independent_background_pattern_ids": [],
      "aperture_pairing_policy": "unknown",
      "repeated_session_ids": [],
      "paired_condition_ids": [],
      "high_fidelity_forward_available": false,
      "notes": "请师兄只选择一个当前最主要的失配，并给出对应的成对证据。"
    }
  },
  "split_contract": {
    "split_unit": "unknown",
    "training_unit_ids": [],
    "tuning_unit_ids": [],
    "validation_unit_ids": [],
    "audit_unit_ids": [],
    "audit_locked": false,
    "audit_opened": false,
    "frozen_at_utc": null,
    "split_digest_sha256": null,
    "random_frame_split_permitted": false
  },
  "endpoints": {
    "primary": {
      "name": "heldout_reprojection_relative_l2",
      "direction": "lower_is_better",
      "truth_required": false
    },
    "secondary": [],
    "heldout_mask_policy": "unknown",
    "external_reference_path": null,
    "external_reference_provenance": "unknown",
    "cost_ledger": ["forward_calls", "adjoint_calls", "wall_time", "peak_memory"]
  },
  "permissions": {
    "local_storage": false,
    "local_training": false,
    "group_meeting": false,
    "thesis_text": false,
    "thesis_figures": false,
    "public_metadata": false,
    "public_derived_metrics": false,
    "public_raw_data": false,
    "redistribution_basis": "unknown"
  },
  "claim_boundary": {
    "real_field_truth_claim_allowed": false,
    "heldout_reprojection_is_unique_3d_truth": false,
    "audit_may_select_model": false,
    "audit_may_select_stopping": false,
    "synthetic_and_experimental_metrics_kept_separate": true
  }
}
